{
  "report_title": "示例企业出海一级市场投资分析报告",
  "version": "v2-investment-grade",
  "language": "zh-CN",
  "investment_analysis_report": {
    "executive_summary": {
      "title": "1. Executive Summary",
      "conclusion": "围绕总体投资结论、目标市场排序和 12-24 个月关键抓手给出结论先行的投资分析判断；如来源不足需写明需人工复核。",
      "key_findings": [
        {
          "finding": "总体投资结论、目标市场排序和 12-24 个月关键抓手的核心发现",
          "implication": "对目标国家选择、进入节奏、融资扩产或资源匹配的影响",
          "priority": "高/中/低"
        }
      ],
      "evidence": [
        {
          "claim": "支撑结论的事实、数据或规则引擎结果",
          "source_type": "enterprise_data/rule_engine/context_bundle/retrieved_context/web_research/manual_assumption",
          "citation_id": "citation_id 或 需人工复核",
          "manual_review_required": true,
          "notes": "凡涉及具体市场规模、增长率、关税、政策、准入规则、认证有效性、补贴/基金条件、展会时间/费用等动态信息，必须在 evidence 中写明 citation_id 并在 citations 中提供来源；来源不足时不得给出确定数值，只能写“需人工复核”。"
        }
      ],
      "recommendation": [
        {
          "action": "可执行建议",
          "owner": "企业/顾问/渠道伙伴/资源方",
          "timeline": "0-3个月/3-6个月/6-12个月/12-24个月",
          "expected_output": "交付物或验证结果"
        }
      ],
      "assumptions": [
        "列明测算、评分、国家优先级或预算 KPI 的假设；来源不足写需人工复核。"
      ],
      "missing_information": [
        "缺失字段、需补充材料、需人工复核事项及补齐动作。"
      ],
      "citations": [
        {
          "citation_id": "citation_id",
          "source_title": "来源标题或输入对象名称",
          "source_url": "URL/文件名/系统字段路径；无来源则写需人工复核",
          "source_type": "enterprise_data/rule_engine/local_knowledge/web_research/manual_review",
          "excerpt_or_fact": "不超过一句话的证据摘要",
          "review_status": "已引用/需人工复核"
        }
      ],
      "confidence_level": "高"
    },
    "enterprise_profile": {
      "title": "2. Enterprise Profile",
      "conclusion": "围绕企业基本面、经营能力、组织与出海历史给出结论先行的投资分析判断；如来源不足需写明需人工复核。",
      "key_findings": [
        {
          "finding": "企业基本面、经营能力、组织与出海历史的核心发现",
          "implication": "对目标国家选择、进入节奏、融资扩产或资源匹配的影响",
          "priority": "高/中/低"
        }
      ],
      "evidence": [
        {
          "claim": "支撑结论的事实、数据或规则引擎结果",
          "source_type": "enterprise_data/rule_engine/context_bundle/retrieved_context/web_research/manual_assumption",
          "citation_id": "citation_id 或 需人工复核",
          "manual_review_required": true,
          "notes": "凡涉及具体市场规模、增长率、关税、政策、准入规则、认证有效性、补贴/基金条件、展会时间/费用等动态信息，必须在 evidence 中写明 citation_id 并在 citations 中提供来源；来源不足时不得给出确定数值，只能写“需人工复核”。"
        }
      ],
      "recommendation": [
        {
          "action": "可执行建议",
          "owner": "企业/顾问/渠道伙伴/资源方",
          "timeline": "0-3个月/3-6个月/6-12个月/12-24个月",
          "expected_output": "交付物或验证结果"
        }
      ],
      "assumptions": [
        "列明测算、评分、国家优先级或预算 KPI 的假设；来源不足写需人工复核。"
      ],
      "missing_information": [
        "缺失字段、需补充材料、需人工复核事项及补齐动作。"
      ],
      "citations": [
        {
          "citation_id": "citation_id",
          "source_title": "来源标题或输入对象名称",
          "source_url": "URL/文件名/系统字段路径；无来源则写需人工复核",
          "source_type": "enterprise_data/rule_engine/local_knowledge/web_research/manual_review",
          "excerpt_or_fact": "不超过一句话的证据摘要",
          "review_status": "已引用/需人工复核"
        }
      ],
      "confidence_level": "高"
    },
    "product_profile": {
      "title": "3. Product Profile",
      "conclusion": "围绕产品线、应用场景、认证、价格带和交付能力给出结论先行的投资分析判断；如来源不足需写明需人工复核。",
      "key_findings": [
        {
          "finding": "产品线、应用场景、认证、价格带和交付能力的核心发现",
          "implication": "对目标国家选择、进入节奏、融资扩产或资源匹配的影响",
          "priority": "高/中/低"
        }
      ],
      "evidence": [
        {
          "claim": "支撑结论的事实、数据或规则引擎结果",
          "source_type": "enterprise_data/rule_engine/context_bundle/retrieved_context/web_research/manual_assumption",
          "citation_id": "citation_id 或 需人工复核",
          "manual_review_required": true,
          "notes": "凡涉及具体市场规模、增长率、关税、政策、准入规则、认证有效性、补贴/基金条件、展会时间/费用等动态信息，必须在 evidence 中写明 citation_id 并在 citations 中提供来源；来源不足时不得给出确定数值，只能写“需人工复核”。"
        }
      ],
      "recommendation": [
        {
          "action": "可执行建议",
          "owner": "企业/顾问/渠道伙伴/资源方",
          "timeline": "0-3个月/3-6个月/6-12个月/12-24个月",
          "expected_output": "交付物或验证结果"
        }
      ],
      "assumptions": [
        "列明测算、评分、国家优先级或预算 KPI 的假设；来源不足写需人工复核。"
      ],
      "missing_information": [
        "缺失字段、需补充材料、需人工复核事项及补齐动作。"
      ],
      "citations": [
        {
          "citation_id": "citation_id",
          "source_title": "来源标题或输入对象名称",
          "source_url": "URL/文件名/系统字段路径；无来源则写需人工复核",
          "source_type": "enterprise_data/rule_engine/local_knowledge/web_research/manual_review",
          "excerpt_or_fact": "不超过一句话的证据摘要",
          "review_status": "已引用/需人工复核"
        }
      ],
      "confidence_level": "高"
    },
    "overseas_readiness_diagnosis": {
      "title": "4. Overseas Readiness Diagnosis",
      "conclusion": "围绕出海成熟度、短板和补齐优先级给出结论先行的投资分析判断；如来源不足需写明需人工复核。",
      "key_findings": [
        {
          "finding": "出海成熟度、短板和补齐优先级的核心发现",
          "implication": "对目标国家选择、进入节奏、融资扩产或资源匹配的影响",
          "priority": "高/中/低"
        }
      ],
      "evidence": [
        {
          "claim": "支撑结论的事实、数据或规则引擎结果",
          "source_type": "enterprise_data/rule_engine/context_bundle/retrieved_context/web_research/manual_assumption",
          "citation_id": "citation_id 或 需人工复核",
          "manual_review_required": true,
          "notes": "凡涉及具体市场规模、增长率、关税、政策、准入规则、认证有效性、补贴/基金条件、展会时间/费用等动态信息，必须在 evidence 中写明 citation_id 并在 citations 中提供来源；来源不足时不得给出确定数值，只能写“需人工复核”。"
        }
      ],
      "recommendation": [
        {
          "action": "可执行建议",
          "owner": "企业/顾问/渠道伙伴/资源方",
          "timeline": "0-3个月/3-6个月/6-12个月/12-24个月",
          "expected_output": "交付物或验证结果"
        }
      ],
      "assumptions": [
        "列明测算、评分、国家优先级或预算 KPI 的假设；来源不足写需人工复核。"
      ],
      "missing_information": [
        "缺失字段、需补充材料、需人工复核事项及补齐动作。"
      ],
      "citations": [
        {
          "citation_id": "citation_id",
          "source_title": "来源标题或输入对象名称",
          "source_url": "URL/文件名/系统字段路径；无来源则写需人工复核",
          "source_type": "enterprise_data/rule_engine/local_knowledge/web_research/manual_review",
          "excerpt_or_fact": "不超过一句话的证据摘要",
          "review_status": "已引用/需人工复核"
        }
      ],
      "confidence_level": "高"
    },
    "industry_and_market_opportunity": {
      "title": "5. Industry & Market Opportunity",
      "conclusion": "围绕行业趋势、需求场景、市场机会和需复核数据给出结论先行的投资分析判断；如来源不足需写明需人工复核。",
      "key_findings": [
        {
          "finding": "行业趋势、需求场景、市场机会和需复核数据的核心发现",
          "implication": "对目标国家选择、进入节奏、融资扩产或资源匹配的影响",
          "priority": "高/中/低"
        }
      ],
      "evidence": [
        {
          "claim": "市场规模和增长率来源不足，需人工复核。",
          "source_type": "enterprise_data/rule_engine/context_bundle/retrieved_context/web_research/manual_assumption",
          "citation_id": "citation_id 或 需人工复核",
          "manual_review_required": true,
          "notes": "凡涉及具体市场规模、增长率、关税、政策、准入规则、认证有效性、补贴/基金条件、展会时间/费用等动态信息，必须在 evidence 中写明 citation_id 并在 citations 中提供来源；来源不足时不得给出确定数值，只能写“需人工复核”。"
        }
      ],
      "recommendation": [
        {
          "action": "可执行建议",
          "owner": "企业/顾问/渠道伙伴/资源方",
          "timeline": "0-3个月/3-6个月/6-12个月/12-24个月",
          "expected_output": "交付物或验证结果"
        }
      ],
      "assumptions": [
        "列明测算、评分、国家优先级或预算 KPI 的假设；来源不足写需人工复核。"
      ],
      "missing_information": [
        "缺失字段、需补充材料、需人工复核事项及补齐动作。"
      ],
      "citations": [
        {
          "citation_id": "citation_id",
          "source_title": "来源标题或输入对象名称",
          "source_url": "URL/文件名/系统字段路径；无来源则写需人工复核",
          "source_type": "enterprise_data/rule_engine/local_knowledge/web_research/manual_review",
          "excerpt_or_fact": "不超过一句话的证据摘要",
          "review_status": "需人工复核"
        }
      ],
      "confidence_level": "高"
    },
    "target_country_priority_matrix": {
      "title": "6. Target Country Priority Matrix",
      "conclusion": "围绕目标国家优先级、评分、进入模式和风险给出结论先行的投资分析判断；如来源不足需写明需人工复核。",
      "key_findings": [
        {
          "finding": "目标国家优先级、评分、进入模式和风险的核心发现",
          "implication": "对目标国家选择、进入节奏、融资扩产或资源匹配的影响",
          "priority": "高/中/低"
        }
      ],
      "evidence": [
        {
          "claim": "支撑结论的事实、数据或规则引擎结果",
          "source_type": "enterprise_data/rule_engine/context_bundle/retrieved_context/web_research/manual_assumption",
          "citation_id": "citation_id 或 需人工复核",
          "manual_review_required": true,
          "notes": "凡涉及具体市场规模、增长率、关税、政策、准入规则、认证有效性、补贴/基金条件、展会时间/费用等动态信息，必须在 evidence 中写明 citation_id 并在 citations 中提供来源；来源不足时不得给出确定数值，只能写“需人工复核”。"
        }
      ],
      "recommendation": [
        {
          "action": "可执行建议",
          "owner": "企业/顾问/渠道伙伴/资源方",
          "timeline": "0-3个月/3-6个月/6-12个月/12-24个月",
          "expected_output": "交付物或验证结果"
        }
      ],
      "assumptions": [
        "列明测算、评分、国家优先级或预算 KPI 的假设；来源不足写需人工复核。"
      ],
      "missing_information": [
        "缺失字段、需补充材料、需人工复核事项及补齐动作。"
      ],
      "citations": [
        {
          "citation_id": "citation_id",
          "source_title": "来源标题或输入对象名称",
          "source_url": "URL/文件名/系统字段路径；无来源则写需人工复核",
          "source_type": "enterprise_data/rule_engine/local_knowledge/web_research/manual_review",
          "excerpt_or_fact": "不超过一句话的证据摘要",
          "review_status": "已引用/需人工复核"
        }
      ],
      "confidence_level": "高"
    },
    "competitor_and_price_band_analysis": {
      "title": "7. Competitor & Price Band Analysis",
      "conclusion": "围绕竞品格局、替代品、价格带和差异化空间给出结论先行的投资分析判断；如来源不足需写明需人工复核。",
      "key_findings": [
        {
          "finding": "竞品格局、替代品、价格带和差异化空间的核心发现",
          "implication": "对目标国家选择、进入节奏、融资扩产或资源匹配的影响",
          "priority": "高/中/低"
        }
      ],
      "evidence": [
        {
          "claim": "支撑结论的事实、数据或规则引擎结果",
          "source_type": "enterprise_data/rule_engine/context_bundle/retrieved_context/web_research/manual_assumption",